{
  "$schema": "https://json-schema.org/draft/2020-12/schema",
  "$id": "https://agentclash.dev/schemas/voice-live-continuity-report.schema.json",
  "title": "AgentClash Voice Live Continuity Report",
  "type": "object",
  "required": ["schema_version", "type", "status", "passed", "metrics"],
  "additionalProperties": true,
  "properties": {
    "schema_version": {
      "type": "string",
      "minLength": 1
    },
    "type": {
      "type": "string",
      "pattern": "^\\s*(agentclash\\.voice\\.live_continuity_eval\\.v1|voicey\\.live_continuity_eval)\\s*$"
    },
    "status": {
      "enum": ["passed", "warn", "failed", "degraded"]
    },
    "passed": {
      "type": "boolean"
    },
    "input": {
      "type": "string"
    },
    "metrics": {
      "type": "object",
      "required": ["evidence_status"],
      "additionalProperties": true,
      "properties": {
        "speech_start_count": { "type": "integer", "minimum": 0 },
        "speech_stop_count": { "type": "integer", "minimum": 0 },
        "output_event_count": { "type": "integer", "minimum": 0 },
        "evidence_status": { "enum": ["available", "degraded"] },
        "median_first_audio_ms": { "type": "number", "minimum": 0 },
        "p90_first_audio_ms": { "type": "number", "minimum": 0 },
        "max_output_gap_ms": { "type": "number", "minimum": 0 },
        "median_output_gap_ms": { "type": "number", "minimum": 0 },
        "speech_no_output_count": { "type": "integer", "minimum": 0 },
        "speech_no_output_ratio": { "type": "number", "minimum": 0, "maximum": 1 },
        "speech_start_during_output_count": { "type": "integer", "minimum": 0 }
      }
    },
    "caveats": {
      "type": "array",
      "items": { "type": "string" }
    },
    "agentclash_notes": {
      "type": "array",
      "items": { "type": "string" }
    }
  },
  "oneOf": [
    {
      "properties": {
        "status": { "const": "passed" },
        "passed": { "const": true },
        "metrics": {
          "properties": {
            "evidence_status": { "const": "available" }
          }
        }
      }
    },
    {
      "properties": {
        "status": { "enum": ["warn", "failed", "degraded"] },
        "passed": { "const": false }
      }
    }
  ]
}
